{
  "schema_version": "0.9.0",
  "model_id": "model-lh-two-site-synthetic-2026-09-01-fa1957",
  "family": "microkinetic",
  "algorithm": "lh-two-site",
  "interpretable": true,
  "description": "SYNTHETIC. Two-site Langmuir-Hinshelwood model, fit to the synthetic PRBS trace. Present so the model schema has a worked example; the numbers are invented and describe no real catalyst.",
  "architecture": {
    "summary": "Two site types, competitive adsorption, one surface reaction.",
    "n_parameters": 3,
    "n_species": 3,
    "n_reactions": 3
  },
  "hyperparameters": {
    "solver": "radau",
    "rtol": 1e-08,
    "atol": 1e-10,
    "parameter_transform": "log10"
  },
  "seed": 20260820,
  "features": [
    {
      "name": "m28_conc",
      "units": "mol/m^3",
      "quantity": "concentration",
      "source": "m28"
    },
    {
      "name": "m32_conc",
      "units": "mol/m^3",
      "quantity": "concentration",
      "source": "m32"
    },
    {
      "name": "m44_conc",
      "units": "mol/m^3",
      "quantity": "concentration",
      "source": "m44"
    }
  ],
  "parameters_ref": "art://fit-prbs-co-ox-synthetic-2026-09-01-deaec8",
  "uncertainty_ref": "art://fit-prbs-co-ox-synthetic-2026-09-01-deaec8",
  "training_data": {
    "dataset_ids": [
      "prbs-co-ox-synthetic-001"
    ],
    "sample_ids": [
      "SYNTH-CATALYST-001"
    ],
    "n_observations": 5080,
    "splits": {
      "strategy": "leave_one_batch_out",
      "grouped_by": [
        "batch_id"
      ],
      "train": [
        "synthetic-batch-a"
      ],
      "test": [
        "synthetic-batch-b"
      ],
      "seed": 20260820,
      "notes": "Grouped by batch so no batch spans the split. Ungrouped splitting of this data leaks: a PRBS trace is autocorrelated and repeated conditions share a lineage."
    }
  },
  "metrics": {
    "steady_state_rate_rel_error": {
      "value": 11.8,
      "units": "%",
      "split": "held_out",
      "interval": [
        8.4,
        15.9
      ],
      "interval_kind": "95% CI",
      "n": 6,
      "notes": "SYNTHETIC. This study's target for held-out prediction is <= 15%."
    },
    "trace_nrmse": {
      "value": 0.041,
      "units": "1",
      "split": "test",
      "interval": [
        0.033,
        0.052
      ],
      "interval_kind": "95% CI",
      "n": 6
    }
  },
  "identifiability": {
    "identifiable": [
      "log10_k_rxn"
    ],
    "unidentifiable": [
      "log10_k_ads",
      "log10_k_des"
    ],
    "criterion": "profile likelihood",
    "notes": "SYNTHETIC. Adsorption and desorption are correlated along a flat direction here, which is the normal situation and the reason an worded in terms of IDENTIFIABLE constants."
  },
  "limitations": "SYNTHETIC MODEL -- not usable for any real prediction. Even taken on its own terms it was fit at a single temperature (473 K), on one synthetic sample, under PRBS forcing only. It has not been validated on chemical-looping operation, on any temperature ramp, or on any other catalyst, and only one of its three rate constants is identifiable.",
  "software": {
    "name": "tcat-tool-standard",
    "repository": "https://github.com/TransientCatalysis/tcat-tool-standard",
    "version": "0.1.0",
    "license": "MIT"
  },
  "example_use": "examples/worked_example.py",
  "autonomy_level": "A1",
  "access_status": "public",
  "license": "CC-BY-4.0",
  "project": "genesis-prbs-phase-1",
  "objective": {
    "label": "1b-mechanism",
    "milestone": "identifiable-constants"
  },
  "notes": "Generated by examples/make_examples.py. No solve was performed."
}
